Name,Hash_Key,Offcd ,Wk_S,Wk_E,Jbt
赵乐际,ff265e02707e585eaf45c04e9a4d5d615f60832f,0000007914,2003.00,2004.00,青海省委书记
赵乐际,ff265e02707e585eaf45c04e9a4d5d615f60832f,0000007914,2004.00,2007.00,青海省委书记、省人大常委会主任（2002－2005年中央党校在职研究生班政治学专业学习）
赵乐际,ff265e02707e585eaf45c04e9a4d5d615f60832f,0000007914,2007.00,2008.00,陕西省委书记
赵乐际,ff265e02707e585eaf45c04e9a4d5d615f60832f,0000007914,2008.00,2012.00,陕西省委书记、省人大常委会主任
赵乐际,ff265e02707e585eaf45c04e9a4d5d615f60832f,0000007914,2012.00,,中央政治局委员、中央书记处书记，中央组织部部长，陕西省委书记、省人大常委会主任（至2012年11月）[1-2]?
赵寿山,f0da2d98e8179b91fbee0271d4b13594a93d2054,0000007963,1894.00,1965.00,原名赵生龄，1894年农历11月21日生于陕西户县北乡(现更名为渭丰乡)定舟村
赵寿山,f0da2d98e8179b91fbee0271d4b13594a93d2054,0000007963,1924.00,  ,参加杨虎城部队，历任排、连、营、团、旅、师、军长，集团军总司令
赵寿山,f0da2d98e8179b91fbee0271d4b13594a93d2054,0000007963,1947.00,  ,进入解放区，1948年1月任西北野战军副司令员
赵寿山,f0da2d98e8179b91fbee0271d4b13594a93d2054,0000007963,1965.06,  ,因病在北京逝世
赵寿山,f0da2d98e8179b91fbee0271d4b13594a93d2054,0000007963,1926.01,  ,赵寿山随杨虎城将军坚守西安八个月，打退北洋军阀吴佩孚部刘镇华的围攻
赵寿山,f0da2d98e8179b91fbee0271d4b13594a93d2054,0000007963,1930.05,  ,蒋（介石）、冯（玉祥）、阎（锡山）中原大战，杨部参加对冯、阎作战，赵升任旅长，年底任绥靖司令
赵寿山,f0da2d98e8179b91fbee0271d4b13594a93d2054,0000007963,1935.00,  ,红四方面军由鄂豫皖苏区转移川陕，赵旅被其击溃，赵寿山遂与四方面军密定了互不侵犯协定
赵寿山,f0da2d98e8179b91fbee0271d4b13594a93d2054,0000007963,1936.00,  ,蒋介石调赵部到陕北进攻红军，赵寿山非常苦闷，以到外地看病为名，观察形势
赵寿山,f0da2d98e8179b91fbee0271d4b13594a93d2054,0000007963,1938.00,  ,赵寿山升任三十八军军长，进驻平陆县茅津渡一带
赵寿山,f0da2d98e8179b91fbee0271d4b13594a93d2054,0000007963,1940.00,  ,蒋介石下令调三十八军开赴河南，不久中条山失陷
赵寿山,f0da2d98e8179b91fbee0271d4b13594a93d2054,0000007963,1946.08,  ,国民党反动派撤销他的总司令职务，以派其出国考察水利为名，调他到南京
赵寿山,f0da2d98e8179b91fbee0271d4b13594a93d2054,0000007963,1949.09,  ,为第一届政协全国委员会委员
赵寿山,f0da2d98e8179b91fbee0271d4b13594a93d2054,0000007963,1965.00,  ,赵寿山因患食道癌医治无效，于是年6月20日病逝于北京医院
赵寿山,f0da2d98e8179b91fbee0271d4b13594a93d2054,0000007963,1894.11,  ,生于陕西户县北乡定舟村
赵寿山,f0da2d98e8179b91fbee0271d4b13594a93d2054,0000007963,1909.00,  ,考入陕西陆军小学考入
赵寿山,f0da2d98e8179b91fbee0271d4b13594a93d2054,0000007963,1911.00,  ,入西北大学预科，后转入陕西陆军测量学校学习大学
赵寿山,f0da2d98e8179b91fbee0271d4b13594a93d2054,0000007963,1917.00,  ,秋在陕西靖国军司令部任科员
赵寿山,f0da2d98e8179b91fbee0271d4b13594a93d2054,0000007963,1919.00,  ,到北京，在冯玉祥部第十六混成旅任上尉参谋
赵寿山,f0da2d98e8179b91fbee0271d4b13594a93d2054,0000007963,1921.00,  ,任少校参谋、教官
赵寿山,f0da2d98e8179b91fbee0271d4b13594a93d2054,0000007963,1924.00,  ,赵寿山加入杨虎城部队
赵寿山,f0da2d98e8179b91fbee0271d4b13594a93d2054,0000007963,1926.11,  ,在国民军联军第十军二师混成团任团长
赵寿山,f0da2d98e8179b91fbee0271d4b13594a93d2054,0000007963,1929.11,  ,任国民党军第十七路军十七师五十一旅旅长
赵寿山,f0da2d98e8179b91fbee0271d4b13594a93d2054,0000007963,1930.12,  ,所部进驻汉中
赵寿山,f0da2d98e8179b91fbee0271d4b13594a93d2054,0000007963,1932.10,  ,与红四方面军建立联系，订立互不侵犯的秘密协定，维护与红军合作的局面
赵寿山,f0da2d98e8179b91fbee0271d4b13594a93d2054,0000007963,1935.10,  ,先后到北平、南京、上海，结识进步人士，逐步接受中国共产党关于建立抗日民族统一战线的主张
赵寿山,f0da2d98e8179b91fbee0271d4b13594a93d2054,0000007963,1936.00,  ,曾向杨虎城建议联共反蒋抗日
赵寿山,f0da2d98e8179b91fbee0271d4b13594a93d2054,0000007963,1937.00,  ,抗战爆发赵寿山率领第十七师，自三原誓师北上，转战保定等地
赵寿山,f0da2d98e8179b91fbee0271d4b13594a93d2054,0000007963,1938.00,  ,豫北日军一部企图北犯太行，第十七师予敌重创
赵寿山,f0da2d98e8179b91fbee0271d4b13594a93d2054,0000007963,1938.01,  ,所部开赴晋东南，接受第二战区东路军朱德、彭德怀指挥，先后在山西洪洞、长治、晋城、垣曲地区进行抗日游击作战，配合八路军在晋东南反日军“九路围攻”
赵寿山,f0da2d98e8179b91fbee0271d4b13594a93d2054,0000007963,1942.00,  ,在赵寿山的申请下，中共中央批准接收赵寿山为中共特别党员
赵寿山,f0da2d98e8179b91fbee0271d4b13594a93d2054,0000007963,1942.00,  ,赵老光荣地加入中国共产党
赵寿山,f0da2d98e8179b91fbee0271d4b13594a93d2054,0000007963,1943.00,  ,蒋介石施其调虎离山伎俩，调赵老到重庆中训团受训
赵寿山,f0da2d98e8179b91fbee0271d4b13594a93d2054,0000007963,1944.03,  ,又以明升暗降的手段，调赵老到甘肃武威蒋军嫡系部队任第三集团军空头总司令，而派嫡系亲信张耀明接替三十八军长，实行其“偷梁换柱”、“分编遣散”阴谋
赵寿山,f0da2d98e8179b91fbee0271d4b13594a93d2054,0000007963,1945.07,  ,在河南洛宁故县镇起义，投奔解放区的刘威诚等三十八军2300多人，都是赵老精心培育的正义军人
赵寿山,f0da2d98e8179b91fbee0271d4b13594a93d2054,0000007963,1946.08,  ,被国民党当局撤销了第三集团军总司令职务，调到南京
赵寿山,f0da2d98e8179b91fbee0271d4b13594a93d2054,0000007963,1948.01,  ,任中国人民解放军西北野战军(后为第一野战军暨西北军区)副司令员，为解放西北做出了贡献
赵寿山,f0da2d98e8179b91fbee0271d4b13594a93d2054,0000007963,1952.11,  ,调回陕西，亦任省委常委、省人民政府主席（1954年12月改称陕西省人民委员会省长）
赵寿山,f0da2d98e8179b91fbee0271d4b13594a93d2054,0000007963,1955.00,  ,被授予一级解放勋章
赵寿山,f0da2d98e8179b91fbee0271d4b13594a93d2054,0000007963,1965.06,  ,在北京病逝
赵寿山,f0da2d98e8179b91fbee0271d4b13594a93d2054,0000007963,1935.10,  ,时任17路军17师51旅旅长的赵寿山借看病之名向杨虎城请假离开部队，先后到北平、天津、上海等地观察形势
赵寿山,f0da2d98e8179b91fbee0271d4b13594a93d2054,0000007963,1936.10,  ,赵寿山回到陕西
赵寿山,f0da2d98e8179b91fbee0271d4b13594a93d2054,0000007963,1936.12,  ,晚9时许，杨虎城派小车将赵寿山接到绥靖公署住所
赵寿山,f0da2d98e8179b91fbee0271d4b13594a93d2054,0000007963,1936.12,  ,晨约5时许，赵寿山听到临潼有枪声
赵寿山,f0da2d98e8179b91fbee0271d4b13594a93d2054,0000007963,1936.12,  ,为了迅速安定西安市内的秩序，杨虎城任命赵寿山为西安市公安局局长
赵寿山,f0da2d98e8179b91fbee0271d4b13594a93d2054,0000007963,1937.10,  ,十七师13000余人，奉命扼守山西娘子关正面阵地
赵寿山,f0da2d98e8179b91fbee0271d4b13594a93d2054,0000007963,1938.00,  ,蒋介石把原十七路军改编为三十八军和九十六军两个军
赵寿山,f0da2d98e8179b91fbee0271d4b13594a93d2054,0000007963,1938.03,  ,日军牛岛、川岸师团兵临山西风陵渡
赵寿山,f0da2d98e8179b91fbee0271d4b13594a93d2054,0000007963,1938.07,  ,三万名“陕西冷娃”组成队伍夜渡黄河，开进黄河北岸中条山
赵寿山,f0da2d98e8179b91fbee0271d4b13594a93d2054,0000007963,1938.01,  ,国民党三十八军十七师师长赵寿山秘密访问延安时，接受了中共中央毛泽东主席关于“培养干部、改造部队”的建议
赵寿山,f0da2d98e8179b91fbee0271d4b13594a93d2054,0000007963,1924.00,  ,幕名投奔坚持靖国军旗帜的杨虎城部队，跟随杨南征北战，历任营、团、旅、师、军长等职，逐步成为十七路军著名的爱国进步将领
赵寿山,f0da2d98e8179b91fbee0271d4b13594a93d2054,0000007963,1931.00,  ,“九一八”事变赵寿山对蒋介石的对外妥协、对内内战的政策深为不满
赵寿山,f0da2d98e8179b91fbee0271d4b13594a93d2054,0000007963,1935.00,  ,日军企图侵占华北，进而灭亡全中国
赵寿山,f0da2d98e8179b91fbee0271d4b13594a93d2054,0000007963,1937.00,  ,“七七”事变赵寿山坚持联共抗日立场，在与共产党八路军北抗日寇、南斗重庆的实践中，他的思想觉悟有了进一步提高
赵寿山,f0da2d98e8179b91fbee0271d4b13594a93d2054,0000007963,1938.01,  ,秘密访问延安时，毛主席亲切地会见了他，给他阐述了中国共产党抗日民族统
赵寿山,f0da2d98e8179b91fbee0271d4b13594a93d2054,0000007963,1938.00,  ,中共陕西省委派他到三十八军做上层统战工作，后任三十八军地下党工委委员
赵寿山,f0da2d98e8179b91fbee0271d4b13594a93d2054,0000007963,1942.11,  ,郝克勇由一个排护送赶赴延安
赵寿山,f0da2d98e8179b91fbee0271d4b13594a93d2054,0000007963,1935.10,  ,党中央经过长征到达陕北很快开展了对十七路军的统战工作，他亲自给杨虎城、杜斌丞、孙蔚如写过信，先后派汪锋、王世英和他的秘书张文彬到西安与插虎城谈判，并订立了互不侵犯、共同抗日的协议
赵寿山,f0da2d98e8179b91fbee0271d4b13594a93d2054,0000007963,1938.00,  ,赵寿山访问延安时，毛主席也曾会见过他，并进行过深入交谈
赵寿山,f0da2d98e8179b91fbee0271d4b13594a93d2054,0000007963,1942.00,  ,国民党第三十八军地下党工委派人去延安向毛泽东汇报工作
赵寿山,f0da2d98e8179b91fbee0271d4b13594a93d2054,0000007963,1944.00,  ,任第三集团军总司令
赵寿山,f0da2d98e8179b91fbee0271d4b13594a93d2054,0000007963,1947.03,  ,进入解放区，7月通电起义
赵寿山,f0da2d98e8179b91fbee0271d4b13594a93d2054,0000007963,1948.01,  ,任中国人民解放军第一野战军副司令员
赵寿山,f0da2d98e8179b91fbee0271d4b13594a93d2054,0000007963,1965.06,  ,首都各界在中山公园中山堂举行公祭大会
赵寿山,f0da2d98e8179b91fbee0271d4b13594a93d2054,0000007963,1988.05,  ,在陕西省户县定舟村5000名群众敲锣打鼓庆祝赵寿山将军创办的善慧小学成立52周年大会上，中国对外友好协会副会长兼秘书长83岁的温朋久托人送来了“功在邦国、惠在桑梓”的题词及贺电，以真情来纪念赵寿山这位战友
赵辛初,8f96f8eff352f1d278d4a4b29813392278e6fdbb,0000007991,1938.00,  ,加入中国共产党
赵辛初,8f96f8eff352f1d278d4a4b29813392278e6fdbb,0000007991,1956.07,  ,任湖北省委书记处书记
赵辛初,8f96f8eff352f1d278d4a4b29813392278e6fdbb,0000007991,1958.12,  ,兼副省长
赵辛初,8f96f8eff352f1d278d4a4b29813392278e6fdbb,0000007991,1973.06,  ,任湖北省委书记，省革委会副主任
赵辛初,8f96f8eff352f1d278d4a4b29813392278e6fdbb,0000007991,1980.02,1982.03,任粮食部部长
赵辛初,8f96f8eff352f1d278d4a4b29813392278e6fdbb,0000007991,1937.00,  ,参加革命，1938年2月加入中国共产党，1937年参加革命工作，师范学校毕业师范
赵辛初,8f96f8eff352f1d278d4a4b29813392278e6fdbb,0000007991,1937.00,1945.00,任湖北省立第四小学教员、武昌区党支部书记，中共黄冈县四区区委书记，中共浠水县委书记、孝感县委书记，鄂东游击区中共圻（蕲）春广济黄梅中心县委副书记、书记，后在中共鄂东区委党校学习
赵辛初,8f96f8eff352f1d278d4a4b29813392278e6fdbb,0000007991,1945.00,1949.00,任中共鄂东圻（蕲）春广济黄梅中心县委副书记，中共礼山县委书记，中共鄂东区委组织部副部长，鄂豫区党委五地委委员、专员兼圻北县委书记，新四军第5师鄂皖边指挥部政委，鄂皖军分区副政委，政委，鄂皖地委书记
赵辛初,8f96f8eff352f1d278d4a4b29813392278e6fdbb,0000007991,1949.00,1952.00,任中共湖北省黄冈地委副书记，中共湖北省黄冈地委书记、军分区政委，中共湖北省委副秘书长、秘书长，中共湖北省委常委
赵辛初,8f96f8eff352f1d278d4a4b29813392278e6fdbb,0000007991,1952.00,  ,任中共中央中南局农村工作部副部长，中共湖北省委常委、省委秘书长兼省委政策研究室主任、省委农村工作委员会书记
赵辛初,8f96f8eff352f1d278d4a4b29813392278e6fdbb,0000007991,1955.04,  ,任中共中央书记处第二办公室第四组组长
赵辛初,8f96f8eff352f1d278d4a4b29813392278e6fdbb,0000007991,1956.05,1956.07,任中共湖北省委副书记
赵辛初,8f96f8eff352f1d278d4a4b29813392278e6fdbb,0000007991,1956.07,1965.10,任中共湖北省委书记处书记，其间：
赵辛初,8f96f8eff352f1d278d4a4b29813392278e6fdbb,0000007991,1956.10,1962.10,兼任省委监察委员会书记
赵辛初,8f96f8eff352f1d278d4a4b29813392278e6fdbb,0000007991,1958.12,1964.09,兼任湖北省副省长
赵辛初,8f96f8eff352f1d278d4a4b29813392278e6fdbb,0000007991,1965.04,1967.01,文化大革命”初期（1967年1月）任文化部副部长、党组成员、党委委员
赵辛初,8f96f8eff352f1d278d4a4b29813392278e6fdbb,0000007991,1966.00,1972.00,“文化大革命”中受冲击，下放“五七”干校劳动
赵辛初,8f96f8eff352f1d278d4a4b29813392278e6fdbb,0000007991,1972.00,1973.00,任中共内蒙古自治区委负责人、成员
赵辛初,8f96f8eff352f1d278d4a4b29813392278e6fdbb,0000007991,1973.06,1975.05,任中共湖北省委书记（当时设有第一书记）、湖北省革委会副主任
赵辛初,8f96f8eff352f1d278d4a4b29813392278e6fdbb,0000007991,1975.05,1978.08,任中共湖北省委第一书记、湖北省革委会主任，其间：
赵辛初,8f96f8eff352f1d278d4a4b29813392278e6fdbb,0000007991,1975.07,1978.08,兼任中国人民解放军湖北省军区第一政委，
赵辛初,8f96f8eff352f1d278d4a4b29813392278e6fdbb,0000007991,1975.08,1977.09,兼任中国人民解放军武汉军区政治委员、军区党委书记，
赵辛初,8f96f8eff352f1d278d4a4b29813392278e6fdbb,0000007991,1977.09,1977.12,兼任中国人民解放军武汉军区第一政治委员、军区党委书记，
赵辛初,8f96f8eff352f1d278d4a4b29813392278e6fdbb,0000007991,1977.12,1978.08,兼任中国人民解放军武汉军区政治委员、军区党委书记，
赵辛初,8f96f8eff352f1d278d4a4b29813392278e6fdbb,0000007991,1978.01,1979.02,兼任湖北省政协主席
赵辛初,8f96f8eff352f1d278d4a4b29813392278e6fdbb,0000007991,1978.09,1979.12,任国家计划委员会副主任、党的核心小组副组长、党组副书记
赵辛初,8f96f8eff352f1d278d4a4b29813392278e6fdbb,0000007991,1979.02,1980.01,兼任国家农业委员会副主任、党组成员
赵辛初,8f96f8eff352f1d278d4a4b29813392278e6fdbb,0000007991,1980.02,1982.03,任粮食部部长、党组书记
赵辛初,8f96f8eff352f1d278d4a4b29813392278e6fdbb,0000007991,1991.11,  ,在武汉逝世
赵修,2e476f9ac5ee20a649b25547ed2bb5a716b14948,0000007998,1937.09,  ,参加本村抗日自卫队
赵修,2e476f9ac5ee20a649b25547ed2bb5a716b14948,0000007998,1938.00,  ,加入中国共产党
赵修,2e476f9ac5ee20a649b25547ed2bb5a716b14948,0000007998,1964.09,1968.02,任湖北省副省长
赵修,2e476f9ac5ee20a649b25547ed2bb5a716b14948,0000007998,1972.02,1972.12,任中共湖北省委常委
赵修,2e476f9ac5ee20a649b25547ed2bb5a716b14948,0000007998,1972.12,1977.04,任中共湖北省委书记（当时设有第一书记）
赵修,2e476f9ac5ee20a649b25547ed2bb5a716b14948,0000007998,1975.07,1979.06,任武钢党委第二书记
赵修,2e476f9ac5ee20a649b25547ed2bb5a716b14948,0000007998,1979.06,1982.05,任农业部副部长
赵修,2e476f9ac5ee20a649b25547ed2bb5a716b14948,0000007998,1982.02,1985.05,任中共吉林省委书记（当时设有第一书记）
赵修,2e476f9ac5ee20a649b25547ed2bb5a716b14948,0000007998,1982.06,1983.04,任吉林省副省长
赵修,2e476f9ac5ee20a649b25547ed2bb5a716b14948,0000007998,1983.04,1985.05,任吉林省省长
赵修,2e476f9ac5ee20a649b25547ed2bb5a716b14948,0000007998,1985.06,1988.01,任吉林省第六届人大常委会主任、党组书记
赵修,2e476f9ac5ee20a649b25547ed2bb5a716b14948,0000007998,1992.01,  ,在长春逝世
赵正永,e41cfa8c8c2222265f310363fc6918d29f8f26e1,0000008023,1968.11,1970.11,安徽省宣城地区水阳乡双丰村上山下乡知青
赵正永,e41cfa8c8c2222265f310363fc6918d29f8f26e1,0000008023,1970.11,1974.10,安徽省马钢公司修理部机动车间工人，秘书科秘书
赵正永,e41cfa8c8c2222265f310363fc6918d29f8f26e1,0000008023,1974.10,1977.08,在中南矿冶学院材料系金属物理专业学习
赵正永,e41cfa8c8c2222265f310363fc6918d29f8f26e1,0000008023,1977.08,1979.06,安徽省马钢公司钢铁研究所物理室技术干部，复查办办事员
赵正永,e41cfa8c8c2222265f310363fc6918d29f8f26e1,0000008023,1979.06,1982.08,任安徽省马钢公司钢铁研究所团委副书记，马钢公司团委副书记、书记
赵正永,e41cfa8c8c2222265f310363fc6918d29f8f26e1,0000008023,1982.08,1983.05,任共青团安徽省马鞍山市委书记、党组书记
赵正永,e41cfa8c8c2222265f310363fc6918d29f8f26e1,0000008023,1983.05,1985.09,任安徽省马鞍山市委常委、团市委书记（其间：1983年09月至1985年07月，在中央党校第一期中青年干部培训班学习）
赵正永,e41cfa8c8c2222265f310363fc6918d29f8f26e1,0000008023,1985.09,1988.03,任安徽省马鞍山市委常委、秘书长
赵正永,e41cfa8c8c2222265f310363fc6918d29f8f26e1,0000008023,1988.03,1992.05,任安徽省马鞍山市委副书记
赵正永,e41cfa8c8c2222265f310363fc6918d29f8f26e1,0000008023,1992.05,1993.04,任安徽省黄山市委副书记
赵正永,e41cfa8c8c2222265f310363fc6918d29f8f26e1,0000008023,1993.04,1998.04,任安徽省黄山市委书记，黄山军分区第一书记、第一政委
赵正永,e41cfa8c8c2222265f310363fc6918d29f8f26e1,0000008023,1998.04,2000.05,任安徽省公安厅厅长、党委书记，武警安徽省总队第一书记、第一政委
赵正永,e41cfa8c8c2222265f310363fc6918d29f8f26e1,0000008023,2000.05,2001.06,任安徽省委政法委书记，省公安厅厅长、党委书记，武警安徽省总队第一书记、第一政委
赵正永,e41cfa8c8c2222265f310363fc6918d29f8f26e1,0000008023,2001.06,2005.01,任陕西省委常委、政法委书记（其间：2002年09月至2003年01月，在中央党校省部级干部进修班学习）
赵正永,e41cfa8c8c2222265f310363fc6918d29f8f26e1,0000008023,2005.01,2005.08,任陕西省委常委，省人民政府副省长、党组副书记，省委政法委书记
赵正永,e41cfa8c8c2222265f310363fc6918d29f8f26e1,0000008023,2005.08,2010.05,任陕西省委常委，省人民政府副省长、党组副书记，预备役141师第一政委（其间：2006年11月至2007年01月，在中央党校省部级干部进修班学习
赵正永,e41cfa8c8c2222265f310363fc6918d29f8f26e1,0000008023,2007.09,2007.12,在美国哈佛大学研修班学习
赵正永,e41cfa8c8c2222265f310363fc6918d29f8f26e1,0000008023,2010.05,2010.06,任陕西省委副书记，省人民政府副省长、党组副书记，预备役141师第一政委
赵正永,e41cfa8c8c2222265f310363fc6918d29f8f26e1,0000008023,2010.06,2011.01,任陕西省委副书记，省人民政府副省长、代省长、党组书记，预备役141师第一政委
赵正永,e41cfa8c8c2222265f310363fc6918d29f8f26e1,0000008023,2011.01,2012.12,任陕西省委副书记，省人民政府省长、党组书记
赵正永,e41cfa8c8c2222265f310363fc6918d29f8f26e1,0000008023,2012.12,2013.01,任陕西省委书记，陕西省军区党委第一书记
赵正永,e41cfa8c8c2222265f310363fc6918d29f8f26e1,0000008023,2013.01,2016.03,任陕西省委书记、省人大常委会主任，陕西省军区党委第一书记
赵正永,e41cfa8c8c2222265f310363fc6918d29f8f26e1,0000008023,2016.03,2016.04,任陕西省人大常委会主任
赵正永,e41cfa8c8c2222265f310363fc6918d29f8f26e1,0000008023,2016.04,,任第十二届全国人民代表大会内务司法委员会副主任委员
白纪年,37478c291647fe92d0a871499ff2385879db8ddc,0000008125,1939.00,1947.00,在延安边区中学、边区师范学校学习，任陕甘宁边区靖边县清坪区小学教员，延安民教馆馆员，陕甘宁边区三边专署文书、科员，吴旗县政府政务秘书、民政科科长
白纪年,37478c291647fe92d0a871499ff2385879db8ddc,0000008125,1948.00,1949.00,任陕甘宁边区三边专署助理秘书、三边分区青年联合会主任、中国新民主主义青年团三边分区筹备委员会主任
白纪年,37478c291647fe92d0a871499ff2385879db8ddc,0000008125,1949.00,1953.00,任青年团西北工委组织科科长、干部科科长、工委副秘书长兼办公室主任
白纪年,37478c291647fe92d0a871499ff2385879db8ddc,0000008125,1953.05,1955.07,任青年团陕西省委第一副书记
白纪年,37478c291647fe92d0a871499ff2385879db8ddc,0000008125,1955.07,1959.12,任青年团陕西省委第一书记（1954年9月至1966年3月兼任陕西省体育运动委员会副主任，1956年11月至1960年1月任中共陕西省委青年工作委员会书记）
白纪年,37478c291647fe92d0a871499ff2385879db8ddc,0000008125,1959.12,1966.03,任中共陕西省委农村工作部副部长兼省委农村政治部副主任（1964年9月起）
白纪年,37478c291647fe92d0a871499ff2385879db8ddc,0000008125,1966.03,1967.05,任中共陕西省汉中地委副书记
白纪年,37478c291647fe92d0a871499ff2385879db8ddc,0000008125,1976.01,1977.10,任陕西省革委会农林局领导小组组长，1977年10月至1978年11月任陕西省农业局局长、党组书记
白纪年,37478c291647fe92d0a871499ff2385879db8ddc,0000008125,1978.09,1982.07,任陕西省政府农业办公室主任、党组书记，1978年10月至1980年2月任中共陕西省委农村工作部部长
白纪年,37478c291647fe92d0a871499ff2385879db8ddc,0000008125,1979.12,1984.10,任陕西省副省长
白纪年,37478c291647fe92d0a871499ff2385879db8ddc,0000008125,1979.03,1980.11,兼任中共西北农学院党委书记
白纪年,37478c291647fe92d0a871499ff2385879db8ddc,0000008125,1983.03,1984.08,任中共陕西省委常委
白纪年,37478c291647fe92d0a871499ff2385879db8ddc,0000008125,1984.08,1987.08,任中共陕西省委书记
白纪年,37478c291647fe92d0a871499ff2385879db8ddc,0000008125,1983.05,1987.10,兼任陕西省陕北建设委员会第一副主任、主任
白纪年,37478c291647fe92d0a871499ff2385879db8ddc,0000008125,1988.04,  ,当选为政协第七届、八届全国委员会常务委员
白清才,4951cb26a51d506d4b8951925d816a8ecbc70818,0000008137,1949.00,  ,加入中国新民主主义青年团
白清才,4951cb26a51d506d4b8951925d816a8ecbc70818,0000008137,1955.10,  ,加入中国共产党
白清才,4951cb26a51d506d4b8951925d816a8ecbc70818,0000008137,1949.06,  ,参加革命工作，高中
白清才,4951cb26a51d506d4b8951925d816a8ecbc70818,0000008137,1949.00,1959.00,为中国人民银行山西省分行职员、股长、秘书
白清才,4951cb26a51d506d4b8951925d816a8ecbc70818,0000008137,1959.00,1964.00,任山西省财政贸易委员会秘书
白清才,4951cb26a51d506d4b8951925d816a8ecbc70818,0000008137,1964.00,1966.00,任山西省定襄县神山大队“四清”工作队队长，神山大队党总支部书记
白清才,4951cb26a51d506d4b8951925d816a8ecbc70818,0000008137,1966.00,1970.00,“文化大革命”中受冲击
白清才,4951cb26a51d506d4b8951925d816a8ecbc70818,0000008137,1970.00,1973.00,任中共山西省计委办公室副主任、主任
白清才,4951cb26a51d506d4b8951925d816a8ecbc70818,0000008137,1973.00,1975.00,任中共山西省平鲁县“省委工作组”组长兼平鲁县委副书记
白清才,4951cb26a51d506d4b8951925d816a8ecbc70818,0000008137,1975.00,1981.00,任中共山西省委财贸部副部长、省财委副主任
白清才,4951cb26a51d506d4b8951925d816a8ecbc70818,0000008137,1981.00,1983.00,任中共山西省晋东南地委常务书记
白清才,4951cb26a51d506d4b8951925d816a8ecbc70818,0000008137,1983.00,1985.00,任山西省副省长兼省计委主任
白清才,4951cb26a51d506d4b8951925d816a8ecbc70818,0000008137,1985.04,1990.03,任中共山西省委常委、山西省副省长
白清才,4951cb26a51d506d4b8951925d816a8ecbc70818,0000008137,1990.03,1994.11,任中共陕西省委副书记、陕西省省长
白清才,4951cb26a51d506d4b8951925d816a8ecbc70818,0000008137,1994.11,1995.05,在全国供销合作总社筹备组工作
白清才,4951cb26a51d506d4b8951925d816a8ecbc70818,0000008137,1995.05,1997.11,任全国供销合作总社理事会副主任、党组书记
白清才,4951cb26a51d506d4b8951925d816a8ecbc70818,0000008137,1998.03,  ,当选为第九届全国人大常委会委员、全国人大环境与资源保护委员会副主任委员
陈士能,5a987f665edef69bc2b6c0623241adc9d4d603eb,0000008686,1984.00,1991.00,任轻工业部副部长、党组成员
陈士能,5a987f665edef69bc2b6c0623241adc9d4d603eb,0000008686,1991.00,1993.00,任贵州省副省长、省政府党组成员
陈士能,5a987f665edef69bc2b6c0623241adc9d4d603eb,0000008686,1993.00,1996.07,任贵州省省长、省政府党组书记，中共贵州省委副书记
陈士能,5a987f665edef69bc2b6c0623241adc9d4d603eb,0000008686,1996.07,1998.03,任化学工业部党组副书记、副部长（正部长级），兼任化工部机关党委书记、中国昊华化工集团党组书记
