Name,Hash_Key,Offcd ,Wk_S,Wk_E,Jbt
周强,c0ffceaf0ec78a7a69a91634c9fe5fb862519179,0000005297,1995.00,1995.00,司法部法制司司长
周强,c0ffceaf0ec78a7a69a91634c9fe5fb862519179,0000005297,1995.00,1997.00,共青团中央书记处书记
周强,c0ffceaf0ec78a7a69a91634c9fe5fb862519179,0000005297,1997.00,1998.00,共青团中央书记处常务书记
周强,c0ffceaf0ec78a7a69a91634c9fe5fb862519179,0000005297,1998.00,2006.00,共青团中央书记处第一书记（其间：2005.11－2006.01中央党校省部级干部经济体制改革专题研究班学习）
周强,c0ffceaf0ec78a7a69a91634c9fe5fb862519179,0000005297,2006.00,2006.00,湖南省委副书记、代省长，共青团中央书记处第一书记
周强,c0ffceaf0ec78a7a69a91634c9fe5fb862519179,0000005297,2006.00,2007.00,湖南省委副书记、代省长
周强,c0ffceaf0ec78a7a69a91634c9fe5fb862519179,0000005297,2007.00,2010.00,湖南省委副书记、省长
周强,c0ffceaf0ec78a7a69a91634c9fe5fb862519179,0000005297,2010.00,2010.00,湖南省委书记
周强,c0ffceaf0ec78a7a69a91634c9fe5fb862519179,0000005297,2010.00,2013.00,湖南省委书记、省人大常委会主任
周强,c0ffceaf0ec78a7a69a91634c9fe5fb862519179,0000005297,2013.00,2013.03,最高人民法院院长、党组书记，湖南省委书记
周强,c0ffceaf0ec78a7a69a91634c9fe5fb862519179,0000005297,2013.03,2013.05,省人大常委会主任
周强,c0ffceaf0ec78a7a69a91634c9fe5fb862519179,0000005297,2015.07,,任中华司法研究会会长
周兴,5229e098dc73fa65df83cba6aee495f673ee021f,0000005323,1905.00,1975.00,1925年参加革命
周兴,5229e098dc73fa65df83cba6aee495f673ee021f,0000005323,1934.10,  ,参加中央红军二万五千里长征
周兴,5229e098dc73fa65df83cba6aee495f673ee021f,0000005323,1925.00,  ,参加革命，同年夏加入中国共产主义青年团
周兴,5229e098dc73fa65df83cba6aee495f673ee021f,0000005323,1926.00,  ,转为中国共产党党员
周兴,5229e098dc73fa65df83cba6aee495f673ee021f,0000005323,1927.00,  ,入南昌朱德军官教育团学习学习
周兴,5229e098dc73fa65df83cba6aee495f673ee021f,0000005323,1929.00,  ,历任中共党支部书记，区委秘书长，水东中心县委委员，赣西南中路总指挥部秘书长等职
周兴,5229e098dc73fa65df83cba6aee495f673ee021f,0000005323,1931.04,  ,调任江西省苏维埃政府政治保卫局秘书长，后改任保卫局执行部部长
周兴,5229e098dc73fa65df83cba6aee495f673ee021f,0000005323,1933.00,  ,仍调任省保卫局执行部部长
周兴,5229e098dc73fa65df83cba6aee495f673ee021f,0000005323,1935.00,  ,担任红一军团政治保卫局副局长
周兴,5229e098dc73fa65df83cba6aee495f673ee021f,0000005323,1937.00,  ,改任陕甘宁特区政府保安处处长
周兴,5229e098dc73fa65df83cba6aee495f673ee021f,0000005323,1949.00,  ,调任南京市公安局局长
周兴,5229e098dc73fa65df83cba6aee495f673ee021f,0000005323,1960.00,  ,调任中共山东省委书记处书记
周兴,5229e098dc73fa65df83cba6aee495f673ee021f,0000005323,1965.00,  ,改任云南省省长、中共云南省委书记处书记、中共中央西南局委员
周兴,5229e098dc73fa65df83cba6aee495f673ee021f,0000005323,1970.00,  ,担任中共云南省委第一书记兼云南省革命委员会主任，并兼昆明军区政治委员
周兴,5229e098dc73fa65df83cba6aee495f673ee021f,0000005323,1974.05,  ,沙甸问题发生中央作出了正确指示，要周兴亲自处理，落实政策
周兴,5229e098dc73fa65df83cba6aee495f673ee021f,0000005323,1975.10,  ,因病在北京逝世
周永康,49faacf46d51b0befbb90d1e03a46217d1461013,0000005336,1961.00,1966.00,北京石油学院勘探系地球物理勘探专业学习
周永康,49faacf46d51b0befbb90d1e03a46217d1461013,0000005336,1966.00,1967.00,留校待分配
周永康,49faacf46d51b0befbb90d1e03a46217d1461013,0000005336,1967.00,1970.00,大庆油田六七三厂地质队实习员、技术员
周永康,49faacf46d51b0befbb90d1e03a46217d1461013,0000005336,1970.00,1973.00,辽河石油会战指挥部地质团区域室技术员、党支部书记、大队长
周永康,49faacf46d51b0befbb90d1e03a46217d1461013,0000005336,1973.00,1976.00,辽河石油勘探局地球物理勘探处处长
周永康,49faacf46d51b0befbb90d1e03a46217d1461013,0000005336,1976.00,1979.00,辽河石油勘探局政治部副主任
周永康,49faacf46d51b0befbb90d1e03a46217d1461013,0000005336,1979.00,1983.00,辽河石油勘探局副局长兼钻井指挥部党委书记、物探指挥部党委书记兼指挥
周永康,49faacf46d51b0befbb90d1e03a46217d1461013,0000005336,1983.00,1985.00,辽河石油勘探局局长、党委副书记，辽宁省盘锦市委副书记、市长
周永康,49faacf46d51b0befbb90d1e03a46217d1461013,0000005336,1985.00,1988.00,石油工业部副部长、党组成员
周永康,49faacf46d51b0befbb90d1e03a46217d1461013,0000005336,1988.00,1996.00,中国石油天然气总公司副总经理、党组副书记（其间：1989－1990年兼任塔里木石油会战指挥部指挥、临时党委书记
周永康,49faacf46d51b0befbb90d1e03a46217d1461013,0000005336,1989.00,1990.00,兼任胜利石油管理局党委书记、局长和山东省东营市委书记）
周永康,49faacf46d51b0befbb90d1e03a46217d1461013,0000005336,1996.00,1998.00,中国石油天然气总公司总经理、党组书记
周永康,49faacf46d51b0befbb90d1e03a46217d1461013,0000005336,1998.00,1999.00,国土资源部部长、党组书记
周永康,49faacf46d51b0befbb90d1e03a46217d1461013,0000005336,1999.00,2002.00,四川省委书记
周永康,49faacf46d51b0befbb90d1e03a46217d1461013,0000005336,2002.00,2003.00,中央政治局委员、中央书记处书记，中央政法委员会副书记，公安部部长、党委书记
周永康,49faacf46d51b0befbb90d1e03a46217d1461013,0000005336,2003.03,  ,十届全国人大一次会议根据国务院总理温家宝的提名，决定了新一届国务院组成人员，周永康为国务委员
周永康,49faacf46d51b0befbb90d1e03a46217d1461013,0000005336,2003.00,2007.00,中央政治局委员、中央书记处书记，国务委员、国务院党组成员，中央政法委员会副书记，公安部部长（2007.10.28十届全国人大常委会第三十次会议免去其兼任的公安部部长职务）、党委书记
周永康,49faacf46d51b0befbb90d1e03a46217d1461013,0000005336,2007.00,2012.11,中央政治局常委，中央社会治安综合治理委员会主任
周永康,49faacf46d51b0befbb90d1e03a46217d1461013,0000005336,2007.00,2008.03,国务委员、国务院党组成员
周永康,49faacf46d51b0befbb90d1e03a46217d1461013,0000005336,2007.00,2012.12,中央政法委员会书记
周子健,22eaf611b6727559175bb0ff504ee8184c65991b,0000005355,1937.00,1940.00,赴延安，先后入抗大、中央党校学习学习
周子健,22eaf611b6727559175bb0ff504ee8184c65991b,0000005355,1940.00,1952.00,先后任八路军西安办事处科长、处长，中央统战部秘书处副处长、处长
周子健,22eaf611b6727559175bb0ff504ee8184c65991b,0000005355,1952.00,1981.00,调第一机械工业部工作，先后任局长、部长助理、副部长、部长
周子健,22eaf611b6727559175bb0ff504ee8184c65991b,0000005355,1981.00,1983.00,任安徽省省长、省委代理第一书记
周子健,22eaf611b6727559175bb0ff504ee8184c65991b,0000005355,1983.00,  ,受聘担任国家计委特邀顾问
朱镕基,ee248546874434fe12213d0873d76bf027fe009d,0000005367,1947.00,1951.00,在清华大学电机系电机制造专业学习并参加“新民主主义青年联盟”
朱镕基,ee248546874434fe12213d0873d76bf027fe009d,0000005367,1951.00,1952.00,任东北工业部计划处生产计划室副主任
朱镕基,ee248546874434fe12213d0873d76bf027fe009d,0000005367,1952.00,1958.00,在国家计委燃动局、综合局任组长，国家计委主任办公室副处长，国家计委机械局综合处副处长
朱镕基,ee248546874434fe12213d0873d76bf027fe009d,0000005367,1958.00,1969.00,任国家计委干部业余学校教员、国民经济综合局工程师
朱镕基,ee248546874434fe12213d0873d76bf027fe009d,0000005367,1970.00,1975.00,下放国家计委“五七”干校劳动
朱镕基,ee248546874434fe12213d0873d76bf027fe009d,0000005367,1975.00,1979.00,任石油工业部管道局电力通讯工程公司办公室副主任、副主任工程师，中国社会科学院工业经济研究所室主任
朱镕基,ee248546874434fe12213d0873d76bf027fe009d,0000005367,1979.00,1982.00,任国家经委燃动局处长、综合局副局长
朱镕基,ee248546874434fe12213d0873d76bf027fe009d,0000005367,1982.00,1983.00,任国家经委技改局局长，国家经委委员
朱镕基,ee248546874434fe12213d0873d76bf027fe009d,0000005367,1983.00,1985.00,任国家经委副主任、党组成员
朱镕基,ee248546874434fe12213d0873d76bf027fe009d,0000005367,1985.00,1987.00,任国家经委副主任、党组副书记
朱镕基,ee248546874434fe12213d0873d76bf027fe009d,0000005367,1987.00,1991.00,任中共上海市委副书记、市长、市委书记
朱镕基,ee248546874434fe12213d0873d76bf027fe009d,0000005367,1991.00,1992.00,任国务院副总理兼国务院生产办公室主任、党组书记，兼国务院经济贸易办公室主任、党组书记
朱镕基,ee248546874434fe12213d0873d76bf027fe009d,0000005367,1992.10,1993.03,当选为第十四届中共中央政治局委员、常委
朱镕基,ee248546874434fe12213d0873d76bf027fe009d,0000005367,1993.03,  ,在全国人大第八届一次会议上被任命为国务院副总理
朱镕基,ee248546874434fe12213d0873d76bf027fe009d,0000005367,1993.06,1995.06,兼任中国人民银行行长
朱镕基,ee248546874434fe12213d0873d76bf027fe009d,0000005367,1997.09,  ,在中共第十五届一中全会上当选为中央政治局委员、常委
朱镕基,ee248546874434fe12213d0873d76bf027fe009d,0000005367,1998.00,  ,兼任国家科技教育领导小组组长
朱镕基,ee248546874434fe12213d0873d76bf027fe009d,0000005367,1998.03,2003.03,任国务院总理
朱镕基,ee248546874434fe12213d0873d76bf027fe009d,0000005367,1998.04,  ,兼任国家经济体制改革委员会主任，5月兼任国务院三峡工程建设委员会主任
朱小丹,1d2e8ec28ad81fd83435749b2029d245109ad5ad,0000005389,1971.00,1977.00,广东乐器厂工人、团支部书记，广州市乐器总厂团委副书记
朱小丹,1d2e8ec28ad81fd83435749b2029d245109ad5ad,0000005389,1977.00,1982.00,共青团广州市委干部，办公室副主任、主任
朱小丹,1d2e8ec28ad81fd83435749b2029d245109ad5ad,0000005389,1982.00,1984.00,共青团广州市委副书记、党组副书记
朱小丹,1d2e8ec28ad81fd83435749b2029d245109ad5ad,0000005389,1984.00,1987.00,共青团广州市委代书记、书记、党组书记（其间：1985.09-1987.09广州宣传函授学院科学社会主义专业学习）
朱小丹,1d2e8ec28ad81fd83435749b2029d245109ad5ad,0000005389,1987.00,1991.00,从化县委书记，广州市委副秘书长（其间：1990.09-1991.07中央党校中青年干部培训班学习）
朱小丹,1d2e8ec28ad81fd83435749b2029d245109ad5ad,0000005389,1991.00,1996.00,广州市委常委、宣传部部长
朱小丹,1d2e8ec28ad81fd83435749b2029d245109ad5ad,0000005389,1996.00,1999.00,广州市委副书记、宣传部部长（1995.09-1998.07中央党校研究生院经济管理专业在职研究生班学习）
朱小丹,1d2e8ec28ad81fd83435749b2029d245109ad5ad,0000005389,1999.00,2002.00,广州市委副书记
朱小丹,1d2e8ec28ad81fd83435749b2029d245109ad5ad,0000005389,2002.00,2003.00,广东省委统战部常务副部长、部长，省政协副主席
朱小丹,1d2e8ec28ad81fd83435749b2029d245109ad5ad,0000005389,2003.00,2004.00,广东省委常委、宣传部部长，省政协副主席
朱小丹,1d2e8ec28ad81fd83435749b2029d245109ad5ad,0000005389,2004.00,2006.00,广东省委常委、宣传部部长（其间：2004.11-2005.01中央党校省部级干部进修班学习）
朱小丹,1d2e8ec28ad81fd83435749b2029d245109ad5ad,0000005389,2006.00,2007.00,广东省委常委，广州市委书记
朱小丹,1d2e8ec28ad81fd83435749b2029d245109ad5ad,0000005389,2007.00,2010.00,广东省委常委，广州市委书记、市人大常委会主任
朱小丹,1d2e8ec28ad81fd83435749b2029d245109ad5ad,0000005389,2010.00,2011.00,广东省委常委、常务副省长
朱小丹,1d2e8ec28ad81fd83435749b2029d245109ad5ad,0000005389,2011.00,2012.00,广东省委副书记、常务副省长、代省长
朱小丹,1d2e8ec28ad81fd83435749b2029d245109ad5ad,0000005389,2012.00,2015.00,广东省委副书记、省长
朱小丹,1d2e8ec28ad81fd83435749b2029d245109ad5ad,0000005389,2015.00,,广东省委副书记、省长，中国（广东）自由贸易试验区工作领导小组组长
赵紫阳,e2009dca619b27a45082ede6b49f10221dd90223,0000005470,1932.03,1938.02,加入中国共产主义青年团
赵紫阳,e2009dca619b27a45082ede6b49f10221dd90223,0000005470,1938.02,1940.06,加入中国共产党，并入中共冀鲁豫省委党校学习学习
赵紫阳,e2009dca619b27a45082ede6b49f10221dd90223,0000005470,1940.06,1943.00,任中共豫鲁冀边区第二地委（后改为第六地委）书记
赵紫阳,e2009dca619b27a45082ede6b49f10221dd90223,0000005470,1943.00,1945.08,改任中共豫鲁冀边区第四地委宣传部部长
赵紫阳,e2009dca619b27a45082ede6b49f10221dd90223,0000005470,1945.08,1947.00,任地委副书记兼军分区副政治委员、地委书记兼军分区政治委员
赵紫阳,e2009dca619b27a45082ede6b49f10221dd90223,0000005470,1947.00,1949.03,率地方部队随晋冀鲁豫野战军第十纵队南下，任中共桐柏区党委副书记兼桐柏军分区副政治委员
赵紫阳,e2009dca619b27a45082ede6b49f10221dd90223,0000005470,1949.03,1949.10,任中共南阳地委书记兼南阳军分区政治委员
赵紫阳,e2009dca619b27a45082ede6b49f10221dd90223,0000005470,1949.10,1960.00,任中共中央华南分局常务委员、秘书长、农村工作部部长、副书记等职
赵紫阳,e2009dca619b27a45082ede6b49f10221dd90223,0000005470,1960.00,1971.00,历任中共广东省委书记处书记、第二书记、第一书记，中共中央中南局书记处书记，曾兼任广东省军区政治委员、广州军区第三政治委员
赵紫阳,e2009dca619b27a45082ede6b49f10221dd90223,0000005470,1971.00,1975.10,任中共内蒙古自治区委员会书记、广东省委第一书记
赵紫阳,e2009dca619b27a45082ede6b49f10221dd90223,0000005470,1975.10,1978.02,任中共四川省委第一书记兼成都军区第一政治委员
赵紫阳,e2009dca619b27a45082ede6b49f10221dd90223,0000005470,1978.02,1979.09,任政协全国委员会副主席
赵紫阳,e2009dca619b27a45082ede6b49f10221dd90223,0000005470,1979.09,1980.02,中共十一届四中全会在北京举行
赵紫阳,e2009dca619b27a45082ede6b49f10221dd90223,0000005470,1980.02,1980.03,中共十一届五中全会在北京举行
赵紫阳,e2009dca619b27a45082ede6b49f10221dd90223,0000005470,1980.03,1980.04,中共中央发出通知，经中共中央政治局常委批准，赵紫阳负责经济方面的工作，担任财经领导小组组长
赵紫阳,e2009dca619b27a45082ede6b49f10221dd90223,0000005470,1980.04,1981.06,任国务院副总理
赵紫阳,e2009dca619b27a45082ede6b49f10221dd90223,0000005470,1981.06,1981.10,在中共十一届六中全会上增选为中共中央副主席、中央政治局常务委员会委员
赵紫阳,e2009dca619b27a45082ede6b49f10221dd90223,0000005470,1981.10,1982.05,国务院总理赵紫阳在墨西哥坎昆举行的关于合作与发展的国际会议上发言，提出关于国际合作的五项原则：第一，积极支持发展中国家发展民族经济、实现经济上的独立自主以及实行集体自力更生的一切努力
赵紫阳,e2009dca619b27a45082ede6b49f10221dd90223,0000005470,1982.05,1982.09,国务院总理赵紫阳应邀对日本进行正式访问
赵紫阳,e2009dca619b27a45082ede6b49f10221dd90223,0000005470,1982.09,1982.12,中共十二届一中全会在北京举行
赵紫阳,e2009dca619b27a45082ede6b49f10221dd90223,0000005470,1982.12,1983.01,国务院总理赵紫阳应邀先后对埃及、阿尔及利亚、摩洛哥、几内亚、加蓬、扎伊尔、刚果、赞比亚、津巴布韦、坦桑尼亚、肯尼亚进行正式访问
赵紫阳,e2009dca619b27a45082ede6b49f10221dd90223,0000005470,1983.01,1983.01,在访问坦桑尼亚期间，赵紫阳在达累斯萨拉姆举行的记者招待会上宣布了中国同非洲国家经济技术合作的四项原则：平等互利、讲求实效、形式多样、共同发展
赵紫阳,e2009dca619b27a45082ede6b49f10221dd90223,0000005470,1983.01,1983.06,《人民日报》报道：国务院科技领导小组在北京成立，赵紫阳任组长
赵紫阳,e2009dca619b27a45082ede6b49f10221dd90223,0000005470,1983.06,1984.01,中华人民共和国第六届全国人民代表大会第一次会议在北京举行
赵紫阳,e2009dca619b27a45082ede6b49f10221dd90223,0000005470,1984.01,1984.05,国务院总理赵紫阳对美国和加拿大进行正式访问
赵紫阳,e2009dca619b27a45082ede6b49f10221dd90223,0000005470,1984.05,1984.05,六届全国人大二次会议在北京举行
赵紫阳,e2009dca619b27a45082ede6b49f10221dd90223,0000005470,1984.05,1984.09,赵紫阳总理应西欧六国和欧洲共同体的邀请，对法国、比利时、欧洲共同体、瑞典、丹麦、挪威和意大利进行正式友好访问
赵紫阳,e2009dca619b27a45082ede6b49f10221dd90223,0000005470,1984.09,1984.12,赵紫阳给胡耀邦、邓小平、李先念、陈云写信，提出关于经济体制改革中三个问题的意见，主要内容为：第一，计划体制问题
赵紫阳,e2009dca619b27a45082ede6b49f10221dd90223,0000005470,1984.12,1985.03,下午5时30分，中华人民共和国政府和大不列颠及北爱尔兰联合王国政府关于香港问题的联合声明由国务院总理赵紫阳和英国首相玛格丽特·撒切尔夫人在北京人民大会堂西大厅正式签字
赵紫阳,e2009dca619b27a45082ede6b49f10221dd90223,0000005470,1985.03,1986.07,六届全国人大三次会议在北京举行
赵紫阳,e2009dca619b27a45082ede6b49f10221dd90223,0000005470,1986.07,1987.01,国务院总理赵紫阳应邀对罗马尼亚、南斯拉夫、希腊、西班牙、土耳其和突尼斯等国进行正式访问
赵紫阳,e2009dca619b27a45082ede6b49f10221dd90223,0000005470,1987.01,1987.03,中共中央政治局扩大会议在北京举行
赵紫阳,e2009dca619b27a45082ede6b49f10221dd90223,0000005470,1987.03,1987.03,赵紫阳在报给邓小平的《关于草拟十三大报告大纲的设想》中提出，党的十三大的报告拟写七个部分：（一）讲三中全会以来，包括十二大以来，我国出现了哪些历史性的变化
赵紫阳,e2009dca619b27a45082ede6b49f10221dd90223,0000005470,1987.03,1987.03,邓小平作了批示：“这个设计好
赵紫阳,e2009dca619b27a45082ede6b49f10221dd90223,0000005470,1987.03,1987.10,六届全国人大五次会议在北京举行
赵紫阳,e2009dca619b27a45082ede6b49f10221dd90223,0000005470,1987.10,1987.10,中共十二届七中全会在北京举行
赵紫阳,e2009dca619b27a45082ede6b49f10221dd90223,0000005470,1987.10,1987.11,在中国共产党第十三次全国代表大会上向大会作了《沿着有中国特色的社会主义道路前进》的工作报告
赵紫阳,e2009dca619b27a45082ede6b49f10221dd90223,0000005470,1987.11,1987.11,在中共十三届一中全会上当选为中央委员会总书记、中央政治局常务委员会委员，中央政治局委员，并任中共中央军委第一副主席
赵紫阳,e2009dca619b27a45082ede6b49f10221dd90223,0000005470,1987.11,1988.01,第六届全国人大常委会第二十三次会议在北京举行
赵紫阳,e2009dca619b27a45082ede6b49f10221dd90223,0000005470,1988.01,1988.03,中共中央致电中国国民党中央委员会，吊唁中国国民党主席蒋经国在台北病逝
赵紫阳,e2009dca619b27a45082ede6b49f10221dd90223,0000005470,1988.03,1988.04,中共十三届二中全会在北京举行
赵紫阳,e2009dca619b27a45082ede6b49f10221dd90223,0000005470,1988.04,1988.07,在第七届全国人民代表大会第一次会议上，大会确认赵紫阳辞去国务院总理职务的请求，任命赵紫阳为中华人民共和国中央军委副主席
赵紫阳,e2009dca619b27a45082ede6b49f10221dd90223,0000005470,1988.07,1988.09,中共中央总书记赵紫阳致电祝贺李登辉在国民党第十三次代表大会上当选国民党主席，由衷期望两党与全国同胞一道，为早日完成中国统一大业而共同努力
赵紫阳,e2009dca619b27a45082ede6b49f10221dd90223,0000005470,1988.09,1988.09,中共中央政治局召开第十二次全体会议，讨论并通过赵紫阳代表中央政治局在即将召开的中共十三届三中全会上的工作报告
赵紫阳,e2009dca619b27a45082ede6b49f10221dd90223,0000005470,1988.09,1989.06,中共十三届三中全会在北京举行
赵紫阳,e2009dca619b27a45082ede6b49f10221dd90223,0000005470,1989.06,1989.04,在中共十三届四中全会上被撤销他所担任的中共中央总书记、中央政治局常务委员、中央政治局委员、中央委员和中央军事委员会第一副主席的职务
赵紫阳,e2009dca619b27a45082ede6b49f10221dd90223,0000005470,1989.04,1989.04,胡耀邦追悼大会在北京人民大会堂中央大厅隆重举行，中共中央总书记赵紫阳致悼词
赵紫阳,e2009dca619b27a45082ede6b49f10221dd90223,0000005470,1989.04,1989.05,中共中央总书记赵紫阳对朝鲜民主主义人民共和国进行正式友好访问
赵紫阳,e2009dca619b27a45082ede6b49f10221dd90223,0000005470,1989.05,1989.07,赵紫阳会见出席在北京召开的亚洲开发银行理事会第二十二届年会的亚行成员代表团团长及亚行高级官员
赵紫阳,e2009dca619b27a45082ede6b49f10221dd90223,0000005470,1989.07,2005.01,七届全国人大常委会第八次会议撤销其中华人民共和国中央军委副主席职务
赵紫阳,e2009dca619b27a45082ede6b49f10221dd90223,0000005470,2005.01,2005.01,因病医治无效在北京逝世，终年85岁
赵紫阳,e2009dca619b27a45082ede6b49f10221dd90223,0000005470,2005.01,  ,遗体在八宝山革命公墓火化
苏荣,56e689e982498caa257f9c8b28ed95e43f19fed3,0000005506,1968.00,1974.00,吉林省白城市洮安县那金公社新力大队会计、党支部副书记
苏荣,56e689e982498caa257f9c8b28ed95e43f19fed3,0000005506,1974.00,1975.00,吉林省洮安县那金公社党委副书记、书记
苏荣,56e689e982498caa257f9c8b28ed95e43f19fed3,0000005506,1975.00,1980.00,吉林省洮安县委常委，那金公社党委书记、岭下公社党委书记
苏荣,56e689e982498caa257f9c8b28ed95e43f19fed3,0000005506,1980.00,1983.00,吉林省洮安县委副书记（其间:1980.09－1981.01农业部干部培训班沈阳农学院班学习（1982.3－1983.1吉林省委党校党政干部培训班学习）
苏荣,56e689e982498caa257f9c8b28ed95e43f19fed3,0000005506,1983.00,1984.00,吉林省白城地委委员、扶余县委书记
苏荣,56e689e982498caa257f9c8b28ed95e43f19fed3,0000005506,1984.00,1985.00,吉林省委党校党政干部培训班学习
苏荣,56e689e982498caa257f9c8b28ed95e43f19fed3,0000005506,1985.00,1987.00,吉林省白城地委副书记、行署专员
苏荣,56e689e982498caa257f9c8b28ed95e43f19fed3,0000005506,1987.00,1988.00,吉林省白城地委书记、行署专员
苏荣,56e689e982498caa257f9c8b28ed95e43f19fed3,0000005506,1988.00,1989.00,吉林省白城地委书记
苏荣,56e689e982498caa257f9c8b28ed95e43f19fed3,0000005506,1989.00,1990.00,吉林省四平市委书记
苏荣,56e689e982498caa257f9c8b28ed95e43f19fed3,0000005506,1990.00,1992.00,吉林省四平市委书记、市人大常委会主任
苏荣,56e689e982498caa257f9c8b28ed95e43f19fed3,0000005506,1992.00,1995.00,吉林省委常委、秘书长(其间:1994.03－1994.05中央党校省部级干部进修班学习)
苏荣,56e689e982498caa257f9c8b28ed95e43f19fed3,0000005506,1995.00,1996.00,吉林省委常委、延边自治州委书记
苏荣,56e689e982498caa257f9c8b28ed95e43f19fed3,0000005506,1996.00,1998.00,吉林省委副书记、延边自治州委书记(1994－1997年吉林大学经济管理学院国际经济系世界经济专业在职研究生学习，获经济学硕士学位)
苏荣,56e689e982498caa257f9c8b28ed95e43f19fed3,0000005506,1998.00,2001.00,吉林省委副书记
苏荣,56e689e982498caa257f9c8b28ed95e43f19fed3,0000005506,2001.00,2002.00,青海省委书记
苏荣,56e689e982498caa257f9c8b28ed95e43f19fed3,0000005506,2002.00,2003.00,青海省委书记、省人大常委会主任(其间:2003.03－2003.05中央党校省部级干部进修班学习)
苏荣,56e689e982498caa257f9c8b28ed95e43f19fed3,0000005506,2003.00,2004.00,甘肃省委书记
苏荣,56e689e982498caa257f9c8b28ed95e43f19fed3,0000005506,2004.00,2006.00,甘肃省委书记、省人大常委会主任
苏荣,56e689e982498caa257f9c8b28ed95e43f19fed3,0000005506,2006.00,2007.00,中央党校副校长（正部长级）
苏荣,56e689e982498caa257f9c8b28ed95e43f19fed3,0000005506,2007.00,2008.00,江西省委书记
苏荣,56e689e982498caa257f9c8b28ed95e43f19fed3,0000005506,2008.00,2013.00,江西省委书记、省人大常委会主任
苏荣,56e689e982498caa257f9c8b28ed95e43f19fed3,0000005506,2013.00,2014.00,十二届全国政协副主席，江西省委书记（至2013年3月）、省人大常委会主任（至2013年4月）
苏毅然,a269cfd069b857f8cf39f0c993d1f435026ac113,0000005515,1936.02,  ,加入中国共产主义青年团，
苏毅然,a269cfd069b857f8cf39f0c993d1f435026ac113,0000005515,1937.01,  ,转为中国共产党党员，
苏毅然,a269cfd069b857f8cf39f0c993d1f435026ac113,0000005515,1933.06,  ,参加革命工作，中学
苏毅然,a269cfd069b857f8cf39f0c993d1f435026ac113,0000005515,1933.00,1939.00,任川陕省苏维埃税务局稽征员、分所长，在延安中共中央党校、延安马列主义学院学习，参加了长征
