Name,Hash_Key,Offcd ,Wk_S,Wk_E,Jbt
李德生,1d8da2abb58ca63f46b4834a5a94ca356c7b912d,0000002294,1973.08,  ,中国共产党第十次全国代表大会在北京举行
李德生,1d8da2abb58ca63f46b4834a5a94ca356c7b912d,0000002294,1977.04,  ,华国锋与李德生
李德生,1d8da2abb58ca63f46b4834a5a94ca356c7b912d,0000002294,1973.10,  ,江青又开始新的活动
李德生,1d8da2abb58ca63f46b4834a5a94ca356c7b912d,0000002294,1972.00,  ,中央请新疆党政军领导干部到北京开会
李德生,1d8da2abb58ca63f46b4834a5a94ca356c7b912d,0000002294,1972.00,  ,毛泽东、周恩来派李德生到新疆
李德生,1d8da2abb58ca63f46b4834a5a94ca356c7b912d,0000002294,1972.00,  ,毛泽东借张春桥等人之口，提出林彪路线的实质不是极左，而是极右
李德生,1d8da2abb58ca63f46b4834a5a94ca356c7b912d,0000002294,1973.00,  ,毛泽东提出提前召开党的十大
李德生,1d8da2abb58ca63f46b4834a5a94ca356c7b912d,0000002294,1973.03,1973.05,空军党委召开四届五次扩大会议，会议由周恩来、叶剑英
李德生,1d8da2abb58ca63f46b4834a5a94ca356c7b912d,0000002294,1973.06,1973.07,总后在李先念、余秋里主持下，揭发批判林彪、邱会作等人
李德生,1d8da2abb58ca63f46b4834a5a94ca356c7b912d,0000002294,1973.05,  ,总政副主任田维新与派到各兵种的工作组分析研究，向叶剑英写了报告
李德生,1d8da2abb58ca63f46b4834a5a94ca356c7b912d,0000002294,1973.00,  ,毛泽东几次谈到批林批孔，虽然政治局并没有讨论，但两报一刊陆续登出批林批孔的文章
李德生,1d8da2abb58ca63f46b4834a5a94ca356c7b912d,0000002294,1974.01,  ,王洪文、江青将从毛家湾搜集的孔子言论，编成《林彪与孔孟之道》材料之一
李德生,1d8da2abb58ca63f46b4834a5a94ca356c7b912d,0000002294,1974.03,  ,江青、张春桥等人召集几个文艺单位开会，提出“放火烧荒”，提出要整顿军队
李德生,1d8da2abb58ca63f46b4834a5a94ca356c7b912d,0000002294,1976.12,  ,邓小平说：李德生同志一身清，在“四人帮”问题上没有牵扯
李德生,1d8da2abb58ca63f46b4834a5a94ca356c7b912d,0000002294,1980.00,  ,中共中央正式发出文件，为李德生平反，说对李德生同志的一切诬蔑不实之词，一律予以推倒
李德生,1d8da2abb58ca63f46b4834a5a94ca356c7b912d,0000002294,1985.00,  ,历经风风雨雨的李德生从沈阳军区调到国防大学担任政治委员大学
李德生,1d8da2abb58ca63f46b4834a5a94ca356c7b912d,0000002294,1987.00,  ,被选为中共中央顾问委员会常委
李德生,1d8da2abb58ca63f46b4834a5a94ca356c7b912d,0000002294,1988.09,  ,被授予上将军衔
李登瀛,70e7b064b57191127aadae5788758e4003d02e34,0000002298,1914.00,1996.00,男，汉族，1914年生，陕西神木人
李登瀛,70e7b064b57191127aadae5788758e4003d02e34,0000002298,1929.00,  ,加入中国共产主义共青团，1933年秋参加中国工农红军，1934年3月转入中国共产党
李登瀛,70e7b064b57191127aadae5788758e4003d02e34,0000002298,1938.00,  ,任雁北六支队三团政委
李登瀛,70e7b064b57191127aadae5788758e4003d02e34,0000002298,1939.05,  ,任中共右山怀县委书记、中共朔县县委书记，晋察冀边区五地委书记兼军分区政委
李登瀛,70e7b064b57191127aadae5788758e4003d02e34,0000002298,1954.00,1960.00,任中央农村工作部副秘书长、国务院农村办公室副主任、国务院第七办公室副主任
李登瀛,70e7b064b57191127aadae5788758e4003d02e34,0000002298,1960.00,1966.00,任中共中央西北局委员、西北局农村工作部部长
李登瀛,70e7b064b57191127aadae5788758e4003d02e34,0000002298,1977.04,  ,任陕西省革委会副主任
李登瀛,70e7b064b57191127aadae5788758e4003d02e34,0000002298,1978.04,  ,任中共甘肃省委常委、书记
李登瀛,70e7b064b57191127aadae5788758e4003d02e34,0000002298,1979.12,  ,兼甘肃省人大常委会副主任、党组副书记
李登瀛,70e7b064b57191127aadae5788758e4003d02e34,0000002298,1981.02,  ,任中共甘肃省委书记，甘肃省省长（1981年1月起）省政府党组书记，为甘肃各项事业的发展做出积极贡献
李登瀛,70e7b064b57191127aadae5788758e4003d02e34,0000002298,1983.05,1986.05,任甘肃省第六届人大常委会主任、党组书记
李登瀛,70e7b064b57191127aadae5788758e4003d02e34,0000002298,1986.05,  ,任中共甘肃省委党校名誉校长
李登瀛,70e7b064b57191127aadae5788758e4003d02e34,0000002298,1996.03,  ,在北京逝世，享年82岁
李登瀛,70e7b064b57191127aadae5788758e4003d02e34,0000002298,1929.00,  ,加入共青团，1933年秋参加红军，1934年3月入党
李登瀛,70e7b064b57191127aadae5788758e4003d02e34,0000002298,1934.00,1938.09,份任陕甘游击队第二路总指挥部经理处处长、红二十六军四十二师经理处长、西北红军干部学校俱乐部主任、红军大学列宁俱乐部主任，参加了陕甘宁根据地的创建工作
李登瀛,70e7b064b57191127aadae5788758e4003d02e34,0000002298,1935.10,  ,中央红军到达陕北任中央党校总务处长，并在中央党校高级班学习一年学习
李登瀛,70e7b064b57191127aadae5788758e4003d02e34,0000002298,1937.00,  ,受党的派遣，到神府做蒙族上层人士的统战工作，公开身份是八路军120师中校联络参谋
李登瀛,70e7b064b57191127aadae5788758e4003d02e34,0000002298,1938.10,  ,李登瀛同志任中共晋绥边特委左右凉县委宣传部长兼战地动员委员会武装部长，1939年5月任右山怀县委书记
李登瀛,70e7b064b57191127aadae5788758e4003d02e34,0000002298,1940.08,  ,他率领地方武装破坏同蒲铁路、公路、桥梁、电话线，袭击敌伪据点，有力地配合了我军的百团大战
李登瀛,70e7b064b57191127aadae5788758e4003d02e34,0000002298,1940.11,  ,任雁北地委社会部长，1941年8月任晋绥九地委组织部长，1942年5月代理九地委书记
李登瀛,70e7b064b57191127aadae5788758e4003d02e34,0000002298,1944.10,  ,他任朔县中心县委书记负责原五地委的工作
李登瀛,70e7b064b57191127aadae5788758e4003d02e34,0000002298,1945.08,  ,日本侵略者即将投降，他接到塞北工委传达朱德总司令关于收缴敌伪枪支的命令迅速成立雁北前线总指挥部，任总政委，动员和组织根据地军民向敌人据点展开全面进攻，收缴了日伪三个据点的枪支，迫使其他据点的伪军相继投降，先后解放了右玉、平鲁、左云三县城，西雁北大部分地区获得解放
李登瀛,70e7b064b57191127aadae5788758e4003d02e34,0000002298,1945.09,  ,晋绥分局决定恢复五地委和军分区，李登瀛同志任地委书记兼军分区政委
李登瀛,70e7b064b57191127aadae5788758e4003d02e34,0000002298,1949.06,  ,李登瀛同志率晋绥雁北地区一千多名干部南下，支援西南新解放区的工作
李登瀛,70e7b064b57191127aadae5788758e4003d02e34,0000002298,1950.02,  ,任川北区党委常委、组织部长，他参与领导了该地区的清匪、反霸、征粮、土改、政权建设等项工作
李登瀛,70e7b064b57191127aadae5788758e4003d02e34,0000002298,1953.09,  ,任中共中央西南局农工部副部长，为西南地区恢复农业生产、发展经济做了大量工作
李登瀛,70e7b064b57191127aadae5788758e4003d02e34,0000002298,1954.00,1960.00,李登瀛同志被调任中央农村工作部副秘书长，国务院农村办公室副主任
李登瀛,70e7b064b57191127aadae5788758e4003d02e34,0000002298,1960.00,1966.00,任中共中央西北局委员、农村工作部部长，在此期间，正值国民经济困难时期，他认真贯彻中央关于“调整、巩固、充实、提高”的八字方针，从实际出发，采取有效措施，纠正工作中的偏差，为恢复和发展西北地区的农业生产做出了贡献
李登瀛,70e7b064b57191127aadae5788758e4003d02e34,0000002298,1973.00,1978.00,李登瀛同志历任陕西省农办副主任、主任兼渭南地委书记、省革委会副主任
李登瀛,70e7b064b57191127aadae5788758e4003d02e34,0000002298,1978.04,  ,李登瀛同志任甘肃省委书记
李登瀛,70e7b064b57191127aadae5788758e4003d02e34,0000002298,1981.02,  ,任甘肃省省长、省政府党组书记
李登瀛,70e7b064b57191127aadae5788758e4003d02e34,0000002298,1983.05,  ,李登瀛同志任甘肃省人大常委会主任、党组书记
李登瀛,70e7b064b57191127aadae5788758e4003d02e34,0000002298,1986.05,  ,李登瀛同志退居二线，1987年11月在党的十三次全国代表大会上当选为中顾委委员
李贵鲜,4a97d17a65b6acae44b12b88b31663bfbb4115d1,0000002346,1959.00,1960.00,北京外国语学院留苏预备部学习，中国科学技术大学学习
李贵鲜,4a97d17a65b6acae44b12b88b31663bfbb4115d1,0000002346,1960.00,1965.00,苏联莫斯科门氏化工学院工程物理化学系电真空化学专业学习
李贵鲜,4a97d17a65b6acae44b12b88b31663bfbb4115d1,0000002346,1965.00,1967.00,公安部十二局研究所工作
李贵鲜,4a97d17a65b6acae44b12b88b31663bfbb4115d1,0000002346,1967.00,1977.00,国营七七七厂技术员、车间主任、副厂长、总工程师、党委副书记
李贵鲜,4a97d17a65b6acae44b12b88b31663bfbb4115d1,0000002346,1977.00,1979.00,辽宁省锦州市电子工业局副局长、总工程师
李贵鲜,4a97d17a65b6acae44b12b88b31663bfbb4115d1,0000002346,1979.00,1982.00,辽宁省电子工业局副局长、总工程师、党组副书记
李贵鲜,4a97d17a65b6acae44b12b88b31663bfbb4115d1,0000002346,1982.00,1983.00,辽宁省副省长兼省科委主任、党组书记
李贵鲜,4a97d17a65b6acae44b12b88b31663bfbb4115d1,0000002346,1983.00,1985.00,辽宁省委常委、副省长
李贵鲜,4a97d17a65b6acae44b12b88b31663bfbb4115d1,0000002346,1985.00,1986.00,辽宁省委书记
李贵鲜,4a97d17a65b6acae44b12b88b31663bfbb4115d1,0000002346,1986.00,1988.00,安徽省委书记
李贵鲜,4a97d17a65b6acae44b12b88b31663bfbb4115d1,0000002346,1988.00,1993.00,国务委员兼中国人民银行行长、党组书记
李贵鲜,4a97d17a65b6acae44b12b88b31663bfbb4115d1,0000002346,1993.00,1994.00,国务委员
李贵鲜,4a97d17a65b6acae44b12b88b31663bfbb4115d1,0000002346,1994.00,1998.00,国务委员兼国家行政学院院长
李贵鲜,4a97d17a65b6acae44b12b88b31663bfbb4115d1,0000002346,1998.00,  ,任全国政协副主席、党组成员
李贵鲜,4a97d17a65b6acae44b12b88b31663bfbb4115d1,0000002346,2003.03,  ,在全国政协十届一次会议上当选为第十届全国政协副主席
李贵鲜,4a97d17a65b6acae44b12b88b31663bfbb4115d1,0000002346,2003.06,  ,再次当选中国国际交流协会会长
李鸿忠,eb636270378826299f1940918a8ee574afb3a2fd,0000002382,1975.08,1978.02,辽宁省沈阳市郊区知青、大队民兵连长、治保主任、团总支书记、革委会副主任
李鸿忠,eb636270378826299f1940918a8ee574afb3a2fd,0000002382,1978.02,1982.02,吉林大学历史系历史学专业学习
李鸿忠,eb636270378826299f1940918a8ee574afb3a2fd,0000002382,1982.02,1985.04,辽宁省沈阳市政府办公厅秘书处干部，公文处理组副组长
李鸿忠,eb636270378826299f1940918a8ee574afb3a2fd,0000002382,1985.04,1985.06,辽宁省委办公厅秘书
李鸿忠,eb636270378826299f1940918a8ee574afb3a2fd,0000002382,1985.06,1987.09,电子工业部办公厅秘书（1986年07月明确为副处级）
李鸿忠,eb636270378826299f1940918a8ee574afb3a2fd,0000002382,1987.09,1988.11,电子工业部党组办公室副主任、正处级秘书
李鸿忠,eb636270378826299f1940918a8ee574afb3a2fd,0000002382,1988.11,1995.12,挂职任广东省惠州市政府副市长、党组成员（1991年10月明确为副局级）
李鸿忠,eb636270378826299f1940918a8ee574afb3a2fd,0000002382,1995.12,1996.04,广东省惠州市委副书记，市政府代市长、党组书记
李鸿忠,eb636270378826299f1940918a8ee574afb3a2fd,0000002382,1996.04,2000.03,广东省惠州市委副书记，市政府市长、党组书记（其间：1996年09月至1997年07月，中央党校一年制中青年干部培训班学习)
李鸿忠,eb636270378826299f1940918a8ee574afb3a2fd,0000002382,1999.07,2000.03,美国哈佛大学肯尼迪政治学院学习
李鸿忠,eb636270378826299f1940918a8ee574afb3a2fd,0000002382,2000.03,2001.02,广东省惠州市委书记
李鸿忠,eb636270378826299f1940918a8ee574afb3a2fd,0000002382,2001.02,2002.05,广东省政府副省长、党组成员
李鸿忠,eb636270378826299f1940918a8ee574afb3a2fd,0000002382,2002.05,2003.01,广东省委常委，省政府副省长、党组成员
李鸿忠,eb636270378826299f1940918a8ee574afb3a2fd,0000002382,2003.01,2003.06,广东省委常委、省政府常务副省长、党组副书记
李鸿忠,eb636270378826299f1940918a8ee574afb3a2fd,0000002382,2003.06,2004.02,广东省委常委，深圳市委副书记、市政府代市长、党组书记
李鸿忠,eb636270378826299f1940918a8ee574afb3a2fd,0000002382,2004.02,2005.02,广东省委常委，深圳市委副书记、市政府市长、党组书记
李鸿忠,eb636270378826299f1940918a8ee574afb3a2fd,0000002382,2005.02,2005.06,广东省委常委，深圳市委书记、市政府市长、党组书记
李鸿忠,eb636270378826299f1940918a8ee574afb3a2fd,0000002382,2005.06,2007.11,广东省委常委，深圳市委书记，深圳市人大常委会主任、党组书记，深圳警备区党委第一书记
李鸿忠,eb636270378826299f1940918a8ee574afb3a2fd,0000002382,2007.11,2007.12,湖北省委副书记，广东省深圳市人大常委会主任
李鸿忠,eb636270378826299f1940918a8ee574afb3a2fd,0000002382,2007.12,2008.01,湖北省委副书记，省政府代省长、党组书记
李鸿忠,eb636270378826299f1940918a8ee574afb3a2fd,0000002382,2008.01,2010.12,湖北省委副书记、省政府省长、党组书记
李鸿忠,eb636270378826299f1940918a8ee574afb3a2fd,0000002382,2010.12,2011.02,湖北省委书记
李鸿忠,eb636270378826299f1940918a8ee574afb3a2fd,0000002382,2011.02,  ,湖北省委书记、省人大常委会主任
李嘉廷,244794c365eaf7dfe74842d16e52006b866371ec,0000002403,1995.00,1998.01,当选为中共云南省委副书记
李嘉廷,244794c365eaf7dfe74842d16e52006b866371ec,0000002403,1998.01,2001.06,案发任云南省省长
李嘉廷,244794c365eaf7dfe74842d16e52006b866371ec,0000002403,2001.06,2003.05,辞去省长职务
李嘉廷,244794c365eaf7dfe74842d16e52006b866371ec,0000002403,2003.05,  ,北京市第二中级法院以受贿罪判处李嘉廷死刑，缓期二年执行
李建国,47526d6c0c3be9a5ba750ca7a6ea29454389c618,0000002408,1964.00,1969.00,山东大学中文系汉语言文学专业学习
李建国,47526d6c0c3be9a5ba750ca7a6ea29454389c618,0000002408,1969.00,1970.00,留校待分配
李建国,47526d6c0c3be9a5ba750ca7a6ea29454389c618,0000002408,1970.00,1972.00,天津市宁河县东棘坨公社姜庄大队劳动锻炼
李建国,47526d6c0c3be9a5ba750ca7a6ea29454389c618,0000002408,1972.00,1976.00,天津市宁河县文教局、县委宣传部干事
李建国,47526d6c0c3be9a5ba750ca7a6ea29454389c618,0000002408,1976.00,1978.00,天津市农委宣传处干事
李建国,47526d6c0c3be9a5ba750ca7a6ea29454389c618,0000002408,1978.00,1981.00,天津市委办公厅办公室干事
李建国,47526d6c0c3be9a5ba750ca7a6ea29454389c618,0000002408,1981.00,1982.00,天津市委办公厅办公室副主任
李建国,47526d6c0c3be9a5ba750ca7a6ea29454389c618,0000002408,1982.00,1983.00,天津市委办公厅副主任
李建国,47526d6c0c3be9a5ba750ca7a6ea29454389c618,0000002408,1983.00,1988.00,天津市委办公厅主任
李建国,47526d6c0c3be9a5ba750ca7a6ea29454389c618,0000002408,1988.00,1989.00,天津市委副秘书长兼办公厅主任
李建国,47526d6c0c3be9a5ba750ca7a6ea29454389c618,0000002408,1989.00,1991.00,天津市委秘书长
李建国,47526d6c0c3be9a5ba750ca7a6ea29454389c618,0000002408,1991.00,1992.00,天津市委常委、秘书长、和平区委书记
李建国,47526d6c0c3be9a5ba750ca7a6ea29454389c618,0000002408,1992.00,1997.00,天津市委副书记
李建国,47526d6c0c3be9a5ba750ca7a6ea29454389c618,0000002408,1997.00,1998.00,陕西省委书记
李建国,47526d6c0c3be9a5ba750ca7a6ea29454389c618,0000002408,1998.00,2007.00,陕西省委书记、省人大常委会主任
李建国,47526d6c0c3be9a5ba750ca7a6ea29454389c618,0000002408,2007.00,2008.00,山东省委书记
李建国,47526d6c0c3be9a5ba750ca7a6ea29454389c618,0000002408,2008.00,2008.00,山东省委书记、省人大常委会主任
李建国,47526d6c0c3be9a5ba750ca7a6ea29454389c618,0000002408,2008.00,2012.00,十一届全国人大常委会副委员长兼秘书长、党组成员
李建国,47526d6c0c3be9a5ba750ca7a6ea29454389c618,0000002408,2012.00,2013.00,中央政治局委员，十一届全国人大常委会副委员长兼秘书长、党组成员
李建国,47526d6c0c3be9a5ba750ca7a6ea29454389c618,0000002408,2013.00,,中央政治局委员，十二届全国人大常委会副委员长、党组副书记，中华全国总工会主席
李锦斌,3c28a066bc9342a11cdd64e4cccf84abc76e9cc5,0000002446,1974.12,1979.01,在吉林省通化市彩印厂参加工作，任政工干事
李锦斌,3c28a066bc9342a11cdd64e4cccf84abc76e9cc5,0000002446,1979.01,1980.07,任长春师范学院团委干事学院
李锦斌,3c28a066bc9342a11cdd64e4cccf84abc76e9cc5,0000002446,1980.07,1982.08,在长春师范学院政治历史系历史专业学习，毕业后任吉林省教育厅干事
李锦斌,3c28a066bc9342a11cdd64e4cccf84abc76e9cc5,0000002446,1984.04,1985.09,任吉林省教育厅人事处副处长
李锦斌,3c28a066bc9342a11cdd64e4cccf84abc76e9cc5,0000002446,1985.09,1989.03,任吉林省教育委员会干部处副处长
李锦斌,3c28a066bc9342a11cdd64e4cccf84abc76e9cc5,0000002446,1989.03,1991.02,任吉林省教育委员会干部处处长
李锦斌,3c28a066bc9342a11cdd64e4cccf84abc76e9cc5,0000002446,1991.02,1992.09,1991年02月任吉林省教育委员会副主任（1989年07月至1992年07月在吉林大学行政学院政治学专业在职研究生学习；1991年04月至1992年09月挂职任吉林省通榆县委副书记）
李锦斌,3c28a066bc9342a11cdd64e4cccf84abc76e9cc5,0000002446,1992.09,1994.03,任吉林省长春市委常委、组织部部长
李锦斌,3c28a066bc9342a11cdd64e4cccf84abc76e9cc5,0000002446,1994.03,1995.10,任吉林省长春市委副书记、组织部部长（1992年09月至1995年07月在吉林大学经济学院国民经济计划与管理专业在职研究生学习）
李锦斌,3c28a066bc9342a11cdd64e4cccf84abc76e9cc5,0000002446,1995.10,1997.10,任吉林省长春市委副书记（1995年09月至1996年07月参加中央党校中青年干部培训班学习
李锦斌,3c28a066bc9342a11cdd64e4cccf84abc76e9cc5,0000002446,1997.10,1997.11,任吉林省通化市委副书记
李锦斌,3c28a066bc9342a11cdd64e4cccf84abc76e9cc5,0000002446,1997.11,1998.01,任吉林省通化市委副书记、副市长、代理市长
李锦斌,3c28a066bc9342a11cdd64e4cccf84abc76e9cc5,0000002446,1998.01,2001.07,任吉林省通化市委副书记、市长（1995年09月至1998年06月参加吉林大学行政学院政治学理论专业在职研究生学习，获法学博士学位；1999年06月至1999年11月在美国芝加哥伊利诺伊大学MBA班进修）
李锦斌,3c28a066bc9342a11cdd64e4cccf84abc76e9cc5,0000002446,2001.07,2002.08,任吉林省辽源市委书记
李锦斌,3c28a066bc9342a11cdd64e4cccf84abc76e9cc5,0000002446,2002.08,2007.04,任吉林省人民政府副省长
李锦斌,3c28a066bc9342a11cdd64e4cccf84abc76e9cc5,0000002446,2007.04,2013.04,任陕西省委常委、组织部部长
李锦斌,3c28a066bc9342a11cdd64e4cccf84abc76e9cc5,0000002446,2013.04,2013.06,任安徽省委副书记
李锦斌,3c28a066bc9342a11cdd64e4cccf84abc76e9cc5,0000002446,2013.06,2015.05,任安徽省委副书记、省委党校校长（兼）
李锦斌,3c28a066bc9342a11cdd64e4cccf84abc76e9cc5,0000002446,2015.05,2015.06,任安徽省委副书记、省委党校校长，省人民政府省长候选人
李锦斌,3c28a066bc9342a11cdd64e4cccf84abc76e9cc5,0000002446,2015.06,2015.07,任安徽省委副书记，省人民政府副省长、代理省长、党组书记，省委党校校长（兼）
李锦斌,3c28a066bc9342a11cdd64e4cccf84abc76e9cc5,0000002446,2015.07,2015.08,任安徽省委副书记，省人民政府省长、党组书记，省委党校校长（兼）
李锦斌,3c28a066bc9342a11cdd64e4cccf84abc76e9cc5,0000002446,2015.08,  ,任安徽省委副书记，省人民政府省长、党组书记
李克强,ba71b2a945ba970e730a617101c1b158ff7b8bcd,0000002486,1974.00,1976.00,安徽省凤阳县大庙公社东陵大队知青
李克强,ba71b2a945ba970e730a617101c1b158ff7b8bcd,0000002486,1976.00,1978.00,安徽省凤阳县大庙公社大庙大队党支部书记
李克强,ba71b2a945ba970e730a617101c1b158ff7b8bcd,0000002486,1978.00,1982.00,"北京大学法律系学习,校学生会负责人"
李克强,ba71b2a945ba970e730a617101c1b158ff7b8bcd,0000002486,1982.00,1983.00,"北京大学团委书记,共青团中央常委"
李克强,ba71b2a945ba970e730a617101c1b158ff7b8bcd,0000002486,1983.00,1983.00,共青团中央学校部部长兼全国学联秘书长
李克强,ba71b2a945ba970e730a617101c1b158ff7b8bcd,0000002486,1983.00,1985.00,共青团中央书记处候补书记
李克强,ba71b2a945ba970e730a617101c1b158ff7b8bcd,0000002486,1985.00,1993.00,共青团中央书记处书记兼全国青联副主席(其间:1991.09－1991.11中央党校省部级干部进修班学习)
李克强,ba71b2a945ba970e730a617101c1b158ff7b8bcd,0000002486,1993.00,1998.00,共青团中央书记处第一书记兼中国青年政治学院院长
李克强,ba71b2a945ba970e730a617101c1b158ff7b8bcd,0000002486,1988.00,1994.00,"北京大学经济学院经济学专业在职研究生学习,获经济学硕士、博士学位)"
李克强,ba71b2a945ba970e730a617101c1b158ff7b8bcd,0000002486,1998.00,1999.00,"河南省委副书记、代省长,兼任黄河防汛总指挥部总指挥"
李克强,ba71b2a945ba970e730a617101c1b158ff7b8bcd,0000002486,1999.00,2002.00,"河南省委副书记、省长,兼任黄河防汛总指挥部总指挥"
李克强,ba71b2a945ba970e730a617101c1b158ff7b8bcd,0000002486,2002.00,2003.00,"河南省委书记、省长,兼任黄河防汛总指挥部总指挥"
李克强,ba71b2a945ba970e730a617101c1b158ff7b8bcd,0000002486,2003.00,2004.00,河南省委书记、省人大常委会主任
李克强,ba71b2a945ba970e730a617101c1b158ff7b8bcd,0000002486,2004.00,2005.00,辽宁省委书记
李克强,ba71b2a945ba970e730a617101c1b158ff7b8bcd,0000002486,2005.00,2007.00,辽宁省委书记、省人大常委会主任
李克强,ba71b2a945ba970e730a617101c1b158ff7b8bcd,0000002486,2007.00,2008.00,中央政治局常委
李克强,ba71b2a945ba970e730a617101c1b158ff7b8bcd,0000002486,2008.00,2013.00,"中央政治局常委,国务院副总理、党组副书记,国务院三峡工程建设委员会主任,国务院南水北调工程建设委员会主任,国务院深化医药卫生体制改革领导小组组长"
李克强,ba71b2a945ba970e730a617101c1b158ff7b8bcd,0000002486,2013.00,,"中央政治局常委,国务院总理、党组书记,国务院三峡工程建设委员会主任,国务院南水北调工程建设委员会主任,国务院深化医药卫生体制改革领导小组组长"
李力安,9dbeb26db1f76cef85ab285e75e6aca2b0f178aa,0000002496,1920.07,,男，山西五台人
李力安,9dbeb26db1f76cef85ab285e75e6aca2b0f178aa,0000002496,1936.00,  ,参加中华民族解放先锋队
李力安,9dbeb26db1f76cef85ab285e75e6aca2b0f178aa,0000002496,1937.00,  ,参加牺盟会
李力安,9dbeb26db1f76cef85ab285e75e6aca2b0f178aa,0000002496,1958.00,  ,任黑龙江省委书记处书记
李力安,9dbeb26db1f76cef85ab285e75e6aca2b0f178aa,0000002496,1973.04,  ,任黑龙江省委书记
李力安,9dbeb26db1f76cef85ab285e75e6aca2b0f178aa,0000002496,1981.10,  ,任省委第2书记，哈尔滨市委第1书记
李力安,9dbeb26db1f76cef85ab285e75e6aca2b0f178aa,0000002496,1982.07,  ,任省委书记
李力安,9dbeb26db1f76cef85ab285e75e6aca2b0f178aa,0000002496,2015.09,  ,李力安荣获中国人民抗日战争胜利70周年纪念章
李力安,9dbeb26db1f76cef85ab285e75e6aca2b0f178aa,0000002496,1920.07,  ,李力安出生于山西省五台县东冶镇槐荫村的一个贫苦店员家庭
李力安,9dbeb26db1f76cef85ab285e75e6aca2b0f178aa,0000002496,1934.00,,中学
李力安,9dbeb26db1f76cef85ab285e75e6aca2b0f178aa,0000002496,1937.07,  ,"抗日战争爆发,山西形势紧张，刚考入太原中学(高中)的李力安，还没等到开学，就被迫辍学回家考入"
李力安,9dbeb26db1f76cef85ab285e75e6aca2b0f178aa,0000002496,1937.10,  ,聂荣臻率八路军115师一部创建晋察冀抗日根据地，李力安、赵鹏飞在党的指示下，把枪送交给赵尔陆领导的八路军游击司令部
李力安,9dbeb26db1f76cef85ab285e75e6aca2b0f178aa,0000002496,1947.07,  ,李力安代表二地委到西柏坡参加了中共中央工委召开的全国土地会议，会李力安调冀晋四地委工作，兼任井陉县县委书记
李力安,9dbeb26db1f76cef85ab285e75e6aca2b0f178aa,0000002496,1947.00,  ,夏，随着人民解放战争的隆隆炮声，中原解放区不断扩大
李力安,9dbeb26db1f76cef85ab285e75e6aca2b0f178aa,0000002496,1948.03,  ,李力安奉命回二分区选调200名干部到新区工作
李力安,9dbeb26db1f76cef85ab285e75e6aca2b0f178aa,0000002496,1948.09,  ,李力安被任命为两郧地委副书记
李力安,9dbeb26db1f76cef85ab285e75e6aca2b0f178aa,0000002496,1949.05,  ,由陕南部队改编成的第19军溯汉江而上，第二次解放安康
李力安,9dbeb26db1f76cef85ab285e75e6aca2b0f178aa,0000002496,1960.11,  ,他调任组织部调配处处长
李力安,9dbeb26db1f76cef85ab285e75e6aca2b0f178aa,0000002496,1964.09,  ,刚被任命为中央组织部副部长的李力安又调任中共黑龙江省委书记处书记
李力安,9dbeb26db1f76cef85ab285e75e6aca2b0f178aa,0000002496,1972.07,  ,李力安恢复工作，先后任黑龙江省革命委员会政治部主任、中共黑龙江省委书记(当时设有第一、第二书记)
